{
  "programName": "Discrimination Prevention and Defense",
  "programSlug": "discrimination-prevention-defense",
  "registrationUrl": "#registration",
  "meta": {
    "title": "Discrimination Prevention and Defense Training | IAML",
    "description": "Master discrimination law in 2 days. Learn Title VII, ADA, FMLA, ADEA compliance & litigation defense. Earn 13 SHRM/HRCI/CLE credits. Taught by practicing attorneys.",
    "keywords": "discrimination training, Title VII training, ADA compliance, FMLA training, ADEA compliance, employment discrimination, harassment prevention, discrimination defense, HR compliance training, SHRM credits",
    "ogImage": "https://storage.googleapis.com/msgsndr/MjGEy0pobNT9su2YJqFI/media/69093f4637c43adac1bc0ab3.png"
  },
  "seo": {
    "canonicalUrl": "https://www.iaml.com/programs/discrimination-prevention-defense",
    "robots": "index, follow",
    "twitter": {
      "card": "summary_large_image",
      "site": "@IAMLaw",
      "title": "Discrimination Prevention and Defense Training | IAML",
      "description": "Master discrimination law in 2 days. Learn Title VII, ADA, FMLA, ADEA compliance & litigation defense. Earn 13 SHRM/HRCI/CLE credits.",
      "image": "https://storage.googleapis.com/msgsndr/MjGEy0pobNT9su2YJqFI/media/69093f4637c43adac1bc0ab3.png"
    },
    "schema": {
      "educationalLevel": "intermediate",
      "timeRequired": "P2D",
      "teaches": [
        "Title VII Compliance",
        "ADA Accommodation",
        "FMLA Administration",
        "ADEA Compliance",
        "Harassment Prevention",
        "Discrimination Defense",
        "EEOC Process"
      ]
    },
    "keywordData": {
      "primaryKeyword": "discrimination prevention training",
      "searchVolume": 280,
      "competition": "medium",
      "relatedKeywords": [
        "Title VII training",
        "ADA compliance training",
        "harassment prevention training",
        "employment discrimination defense"
      ]
    }
  },
  "hero": {
    "title": "Discrimination Prevention and Defense",
    "description": "Master discrimination law fundamentals across all protected classes. Learn how to identify workplace practices that expose your company to liability and implement preventive measures that strengthen your defense. Train with practicing employment attorneys who handle these cases daily.",
    "price": 1375,
    "deliveryOptions": ["In Person", "Virtual"],
    "duration": "2 days"
  },
  "testimonials": [
    {"quote": "With almost 20 years in the field of employment law, this was one of the best, if not the best, seminar I have ever attended.", "name": "Charles Rando", "title": "Personnel Field Manager", "company": "Wyoming Department of Workforce Services"},
    {"quote": "This is the best course I have ever attended. The instructors are well informed and have a repertoire of stories that emphasize the issues. Course materials are also excellent!", "name": "Debbie Colia", "title": "HR Executive Consultant", "company": "Cedars-Sinai"},
    {"quote": "The seminar was excellent. The instructors were extremely knowledgeable and made a point of allowing the class to interact. This one week not only provided me with knowledge I did not have, it also gave me a new appreciation for what I do.", "name": "Angelique Anderson", "title": "Executive Director, Strategic HR Business Partnerships - People & Culture", "company": "Catalina Marketing"},
    {"quote": "My only wish is that I had attended this seminar earlier in my career! The information I learned is invaluable.", "name": "Christina Lipetzky", "title": "Human Resources Manager", "company": "Montana Department of Environmental Quality"},
    {"quote": "The training both was excellent both in content as well as presentation. I believe the strength of the program lay in the instructors used. All the instructors were fantastic!", "name": "Stephen Santay", "title": "Controller", "company": "KTLA"},
    {"quote": "The seminar was the best. Faculty did an outstanding job of making legal information understandable for non-lawyer professionals. I am planning to attend the Advanced Conference.", "name": "James Dillard", "title": "Personnel Administrator", "company": "Lubrizol"},
    {"quote": "I thought the program was excellent. The content and speakers especially were the best I've experienced in my educational and professional career.", "name": "Laurie Clark", "title": "Benefits Paralegal", "company": "The Coca-Cola Company"},
    {"quote": "All three instructors were wonderful in their own way. Finding attorneys who can teach is a rarity. I found the information current and relevant. It will definitely have an impact on my HR practices. Thank you for a great seminar!", "name": "Heidi Hill", "title": "Director Training, Development and Engagement", "company": "C2 Solutions"},
    {"quote": "Our instructor was a great presenter with great real life examples. His summaries of significant federal employment law were invaluable.", "name": "Tim Hartman", "title": "Sr. Regional HR Manager & HR Counsel", "company": "Silgan Containers"},
    {"quote": "Of all the IAML seminars I have attended, this was by far the best and most informative, especially to HR professionals. I was very pleased with the entire program.", "name": "Barbara Ann Bohlman", "title": "Sr Compensation & Benefits Manager", "company": "The Boca Raton"},
    {"quote": "The information covered in this program was excellent! The speakers were wonderful. They kept the program fresh and interesting.", "name": "Monica Taylor", "title": "Human Resources Manager", "company": "Oak Hall Cap & Gown"},
    {"quote": "The content was current, relevant and very practical. I appreciated the interactive format and the opportunity to network with other professionals facing similar challenges.", "name": "Michael Chen", "title": "Director of Human Resources", "company": "TechSmart Industries"},
    {"quote": "The information was extremely valuable and interesting, I learned a great deal. The instructors did an exceptional job presenting; they were helpful, knowledgeable and entertaining.", "name": "Katie Sanders", "title": "Coordinator of Workforce Development", "company": "Northside Hospital"},
    {"quote": "The seminar offered incredible value for me. The instructors were able to rely on past examples and cases to help illustrate the learning. It was a great learning experience for me.", "name": "Amanda McIvor", "title": "Senior Human Resources Manager", "company": "Gerdau"},
    {"quote": "I have been in HR for 15 years and attended a lot of seminars, this was my first IAML seminar and you can bet my budget dollars were well-spent. I'll continue to look for your seminars first!", "name": "Ruth Erwert", "title": "Recruiting Manager", "company": "Chelan County PUD"},
    {"quote": "Brenda was exceptional. She found the right balance of presenting employment law as it is written, while encouraging relevant experience sharing from participants and her own case work.", "name": "Kristen Van Damm", "title": "Director - Trust Specialties People Leader", "company": "PwC"},
    {"quote": "This was my third IAML seminar and I have been very impressed each time. The information is comprehensive, in-depth, and very relevant. I plan to attend more IAML seminars in the future.", "name": "Gloria Lindsey", "title": "Human Resources Benefits Manager", "company": "Thiele Kaolin Company"},
    {"quote": "It was an excellent seminar and I learned quite a bit. The speakers were great. The information was relevant, current, helpful and could be immediately applied. All in all, it was an excellent event and I'm already budgeting for the Advanced session next year.", "name": "Kelli Whorton", "title": "Human Resources Director", "company": "RLF"},
    {"quote": "This was my first seminar with IAML and I was very impressed! The speakers were great and the sessions were very informative. I will definitely attend again!", "name": "Holly Dean", "title": "Employment Manager", "company": "Alfa Insurance Company"},
    {"quote": "I highly enjoyed this seminar. All of the presenters were extremely knowledgeable and very easy to talk with.", "name": "Jody Ryan", "title": "Human Resources Service Coordinator", "company": "Boeing Company"}
  ],
  "contentSection": {
    "headline": "Master Discrimination Law That Protects Your Organization",
    "description": "Discrimination Prevention and Defense is <span class=\"emphasis\">2 intensive days</span> where you'll master Title VII, ADA, FMLA, ADEA, and Equal Pay compliance—plus learn how to resolve claims without litigation and defend when it happens—working through realistic scenarios with experienced employment attorneys.",
    "benefits": [
      "<strong>Complete discrimination framework</strong> – Title VII harassment, retaliation, LGBTQ+ protections, and compliant DEI programs",
      "<strong>Accommodation and leave expertise</strong> – ADA essential functions, PWFA/PUMP intersections, mental health accommodations, and FMLA coordination",
      "<strong>Defense strategies</strong> – Internal resolution, arbitration programs, EEOC process, and summary-judgment positioning",
      "<strong>Professional certification</strong> – Earn your certificate plus 13 SHRM/HRCI/CLE continuing education credits"
    ]
  },
  "curriculum": {
    "header": {
      "title": "What You'll Master in 2 Days",
      "description": "A comprehensive discrimination law framework covering Title VII, ADA, FMLA, ADEA, claim resolution, litigation defense, and federal contractor compliance."
    },
    "blocks": [
      {
        "id": "block1",
        "label": "Full Program",
        "title": "Discrimination Prevention and Defense",
        "description": "Master discrimination law fundamentals and defense strategies across all protected classes.",
        "price": 1375,
        "availability": "Full program",
        "competencyGroups": [
          {